{"contract":1,"counts":{"by_model":{"src":"nodes/<node>/last.json: nodes the person's assistant decided","unit":"count","value":0},"decisions":{"src":"nodes/<node>/last.json: decisions","unit":"count","value":0},"dropped":{"src":"nodes/<node>/last.json: decisions dropped by the evidence check","unit":"count","value":0},"nodes":{"src":"nodes/<node>/last.json: declared nodes","unit":"count","value":6},"ran":{"src":"nodes/<node>/last.json: nodes with a last run","unit":"count","value":0}},"nodes":[{"assistant":null,"at":null,"cached":false,"cost_usd":null,"decisions":[],"dropped":[],"id":"card_triage","kind":"ai","log":[],"method":null,"model":null,"passes":["decide"],"requires":[],"routes":[{"decision":"confirm","subjects":0,"to":"plan_orderer","when":{"ar":"الدليل يثبتها: تكمل البطاقة إلى الخطة","en":"the evidence holds: the card goes on to the plan"}},{"decision":"doubt","subjects":0,"to":"probe","when":{"ar":"الدليل لا يحسمها: فحص يحسمها قبل أن يراها الشخص","en":"the evidence does not settle it: a probe does, before the person sees the card"}},{"decision":"reject","subjects":0,"to":"library_feedback","when":{"ar":"الدليل ينقضها: تُنحّى وتُبلَّغ قاعدتها","en":"the evidence contradicts the card: it is set aside and its rule is told"}},{"decision":"rules only","subjects":0,"to":"plan_orderer","when":{"ar":"ما قرر مساعد: تكمل البطاقة كما كتبتها المحركات","en":"no assistant decided: the card goes on as the engines wrote it"}}],"seconds":null,"state":"not_run","summary":null,"title":{"ar":"فرز البطاقات","en":"Card triage"},"why":null},{"assistant":null,"at":null,"cached":false,"cost_usd":null,"decisions":[],"dropped":[],"id":"visual_reviewer","kind":"ai","log":[],"method":null,"model":null,"passes":["decide"],"requires":[],"routes":[{"decision":"cards","subjects":0,"to":"plan","when":{"ar":"الصورة تبيّن ما يلاحظه الشخص: كل ملاحظة تصير بطاقة تصميم","en":"the picture shows what a person would notice: each finding becomes a design card"}},{"decision":"clean","subjects":0,"to":"plan","when":{"ar":"الصورة ما فيها شي يتغيّر","en":"the picture shows nothing to change"}},{"decision":"rules only","subjects":0,"to":"plan","when":{"ar":"ما شاف مساعد الصور: تبقى أرقام axe وLighthouse وحدها","en":"no assistant looked: only the axe and Lighthouse numbers stand"}}],"seconds":null,"state":"not_run","summary":null,"title":{"ar":"المراجع البصري","en":"Visual reviewer"},"why":null},{"assistant":null,"at":null,"cached":false,"cost_usd":null,"decisions":[],"dropped":[],"id":"ideal_planner","kind":"ai","log":[],"method":null,"model":null,"passes":["plan","critique"],"requires":[],"routes":[{"decision":"accept","subjects":0,"to":"plan_orderer","when":{"ar":"كل عرض مخطَّط بدليل ولا سؤال باقٍ: يكمل المثالي إلى الخطة","en":"every view planned on evidence, no question left: the ideal goes on to the plan"}},{"decision":"ask","subjects":0,"to":"inbox","when":{"ar":"المثالي يترك أسئلة: تنتظر الشخص في صندوق القرارات","en":"the ideal leaves questions: they wait for the person in the Decisions inbox"}},{"decision":"rules only","subjects":0,"to":"plan_orderer","when":{"ar":"ما خُطِّط: يبقى هدف القواعد","en":"not planned: the rules' target stands"}}],"seconds":null,"state":"not_run","summary":null,"title":{"ar":"مخطِّط المثالي","en":"Ideal planner"},"why":null},{"assistant":null,"at":null,"cached":false,"cost_usd":null,"decisions":[],"dropped":[],"id":"pipeline_gap_planner","kind":"ai","log":[],"method":null,"model":null,"passes":["plan","critique"],"requires":[],"routes":[{"decision":"plan","subjects":0,"to":"plan_orderer","when":{"ar":"خطوة تسد الفجوة، وتكمل إلى الخطة","en":"the gap is closed by a step, which goes on to the plan"}},{"decision":"ask","subjects":0,"to":"inbox","when":{"ar":"سد الفجوة اختيار للشخص","en":"closing the gap is a choice for the person"}},{"decision":"not a gap","subjects":0,"to":"library_feedback","when":{"ar":"قاعدة خط المعالجة لا تنطبق هنا: تُبلَّغ قاعدتها","en":"the pipeline rule does not fit here: its rule is told"}},{"decision":"rules only","subjects":0,"to":"plan_orderer","when":{"ar":"ما قرر مساعد: تبقى فجوة القواعد","en":"no assistant decided: the rules' gap stands"}}],"seconds":null,"state":"not_run","summary":null,"title":{"ar":"مخطِّط فجوات خط المعالجة","en":"Pipeline gap planner"},"why":null},{"assistant":null,"at":null,"cached":false,"cost_usd":null,"decisions":[],"dropped":[],"id":"plan_orderer","kind":"ai","log":[],"method":null,"model":null,"passes":["plan","critique"],"requires":["card_triage","ideal_planner","pipeline_gap_planner"],"routes":[{"decision":"reorder","subjects":0,"to":"plan","when":{"ar":"ترتيب وتجميع أفضل للخطوات، وكل شرط مسبق محفوظ","en":"a better order and grouping of the steps, every prerequisite kept"}},{"decision":"keep","subjects":0,"to":"plan","when":{"ar":"ترتيب القواعد صحيح أصلًا","en":"the rules' order is already right"}},{"decision":"ask","subjects":0,"to":"inbox","when":{"ar":"الترتيب يتوقف على اختيار للشخص","en":"the order depends on a choice for the person"}},{"decision":"rules only","subjects":0,"to":"plan","when":{"ar":"ما قرر مساعد: يبقى ترتيب القواعد","en":"no assistant decided: the rules' order stands"}}],"seconds":null,"state":"not_run","summary":null,"title":{"ar":"مرتّب الخطة","en":"Plan orderer"},"why":null},{"assistant":null,"at":null,"cached":false,"cost_usd":null,"decisions":[],"dropped":[],"id":"fix_reviewer","kind":"ai","log":[],"method":null,"model":null,"passes":["decide"],"requires":["plan_orderer"],"routes":[{"decision":"accept","subjects":0,"to":"handover","when":{"ar":"التعديل يفعل ما تطلبه البطاقة والفحوص سليمة: يُعرض على الشخص","en":"the diff does what the card asks and the checks hold: offered to the person"}},{"decision":"retry","subjects":0,"to":"fix","when":{"ar":"الإصلاح خطأ أو ناقص: يُعاد","en":"the fix is wrong or incomplete: it is made again"}},{"decision":"ask","subjects":0,"to":"inbox","when":{"ar":"الإصلاح يحتاج اختيارًا من الشخص","en":"the fix needs a choice from the person"}},{"decision":"rules only","subjects":0,"to":"gates","when":{"ar":"ما قرر مساعد: يبقى حكم البوابات","en":"no assistant decided: the gates' verdict stands"}}],"seconds":null,"state":"not_run","summary":null,"title":{"ar":"مراجع الإصلاح","en":"Fix reviewer"},"why":null}],"questions":[],"revision":2,"schema_version":1,"sinks":[{"id":"plan","title":{"ar":"الخطة","en":"The plan"}},{"id":"probe","title":{"ar":"فحص يحسمها","en":"A probe"}},{"id":"library_feedback","title":{"ar":"ملاحظات للمكتبة","en":"The library's feedback"}},{"id":"inbox","title":{"ar":"صندوق القرارات","en":"The Decisions inbox"}},{"id":"handover","title":{"ar":"تُعرض على الشخص","en":"Offered to the person"}},{"id":"fix","title":{"ar":"يُصلَح من جديد","en":"Fixed again"}},{"id":"gates","title":{"ar":"حكم البوابات","en":"The gates' verdict"}}]}